2025-08-10 00:51:23.562804: I tensorflow/core/util/port.cc:153] oneDNN custom operations are on. You may see slightly different numerical results due to floating-point round-off errors from different computation orders. To turn them off, set the environment variable `TF_ENABLE_ONEDNN_OPTS=0`.
2025-08-10 00:51:23.574842: E external/local_xla/xla/stream_executor/cuda/cuda_fft.cc:467] Unable to register cuFFT factory: Attempting to register factory for plugin cuFFT when one has already been registered
WARNING: All log messages before absl::InitializeLog() is called are written to STDERR
E0000 00:00:1754783483.628788 1356132 cuda_dnn.cc:8579] Unable to register cuDNN factory: Attempting to register factory for plugin cuDNN when one has already been registered
E0000 00:00:1754783483.643258 1356132 cuda_blas.cc:1407] Unable to register cuBLAS factory: Attempting to register factory for plugin cuBLAS when one has already been registered
W0000 00:00:1754783483.727592 1356132 computation_placer.cc:177] computation placer already registered. Please check linkage and avoid linking the same target more than once.
W0000 00:00:1754783483.727650 1356132 computation_placer.cc:177] computation placer already registered. Please check linkage and avoid linking the same target more than once.
W0000 00:00:1754783483.727659 1356132 computation_placer.cc:177] computation placer already registered. Please check linkage and avoid linking the same target more than once.
W0000 00:00:1754783483.727665 1356132 computation_placer.cc:177] computation placer already registered. Please check linkage and avoid linking the same target more than once.
2025-08-10 00:51:23.735597: I tensorflow/core/platform/cpu_feature_guard.cc:210] This TensorFlow binary is optimized to use available CPU instructions in performance-critical operations.
To enable the following instructions: AVX2 AVX512F AVX512_VNNI FMA, in other operations, rebuild TensorFlow with the appropriate compiler flags.
/scratches/cartwright/mz473/Efficient-Gaussian-Process-on-Graphs/venv/lib/python3.12/site-packages/gpflow/versions.py:1: UserWarning: pkg_resources is deprecated as an API. See https://setuptools.pypa.io/en/latest/pkg_resources.html. The pkg_resources package is slated for removal as early as 2025-11-30. Refrain from using this package or pin to Setuptools<81.
  import pkg_resources
🚀 Framework setup complete
   PyTorch device: cuda:0
   Number of GPUs: 2
   TensorFlow version: 2.19.0
   GPyTorch version: 1.14
📋 Configuration saved to: /scratches/cartwright/mz473/Efficient-Gaussian-Process-on-Graphs/experiments_sparse/scaling_exp/stats/experiment_config_20250810_005139.json

==================== DATA SYNTHESIS ====================
🎲 Synthesizing ring graph data for all graph sizes...
   Feasible sizes (with dense): [32, 64, 128, 256, 512, 1024]
   Sparse-only sizes: [2048, 4096, 8192, 16384, 32768, 65536, 131072, 262144, 524288, 1048576]

Generating feasible datasets (dense+sparse):   0%|          | 0/6 [00:00<?, ?it/s]
Generating feasible datasets (dense+sparse):  17%|█▋        | 1/6 [00:00<00:00,  9.16it/s]
Generating feasible datasets (dense+sparse):  33%|███▎      | 2/6 [00:00<00:00,  9.60it/s]
Generating feasible datasets (dense+sparse):  50%|█████     | 3/6 [00:00<00:00,  9.75it/s]
Generating feasible datasets (dense+sparse):  67%|██████▋   | 4/6 [00:00<00:00,  8.79it/s]
Generating feasible datasets (dense+sparse):  83%|████████▎ | 5/6 [00:00<00:00,  7.24it/s]
Generating feasible datasets (dense+sparse): 100%|██████████| 6/6 [00:01<00:00,  3.52it/s]
Generating feasible datasets (dense+sparse): 100%|██████████| 6/6 [00:01<00:00,  5.04it/s]
   ✓ Generated data for 32 nodes (dense: True)
   ✓ Generated data for 64 nodes (dense: True)
   ✓ Generated data for 128 nodes (dense: True)
   ✓ Generated data for 256 nodes (dense: True)
   ✓ Generated data for 512 nodes (dense: True)
   ✓ Generated data for 1024 nodes (dense: True)

Generating sparse-only datasets:   0%|          | 0/10 [00:00<?, ?it/s]
Generating sparse-only datasets:  10%|█         | 1/10 [00:00<00:03,  2.46it/s]
Generating sparse-only datasets:  20%|██        | 2/10 [00:00<00:03,  2.46it/s]
Generating sparse-only datasets:  30%|███       | 3/10 [00:01<00:03,  2.03it/s]
Generating sparse-only datasets:  40%|████      | 4/10 [00:02<00:03,  1.64it/s]
Generating sparse-only datasets:  50%|█████     | 5/10 [00:03<00:03,  1.41it/s]
Generating sparse-only datasets:  60%|██████    | 6/10 [00:04<00:03,  1.03it/s]
Generating sparse-only datasets:  70%|███████   | 7/10 [00:07<00:05,  1.72s/it]
Generating sparse-only datasets:  80%|████████  | 8/10 [00:11<00:04,  2.40s/it]
Generating sparse-only datasets:  90%|█████████ | 9/10 [00:20<00:04,  4.32s/it]
Generating sparse-only datasets: 100%|██████████| 10/10 [00:38<00:00,  8.65s/it]
Generating sparse-only datasets: 100%|██████████| 10/10 [00:38<00:00,  3.86s/it]
   ✓ Generated data for 2048 nodes (sparse-only)
   ✓ Generated data for 4096 nodes (sparse-only)
   ✓ Generated data for 8192 nodes (sparse-only)
   ✓ Generated data for 16384 nodes (sparse-only)
   ✓ Generated data for 32768 nodes (sparse-only)
   ✓ Generated data for 65536 nodes (sparse-only)
   ✓ Generated data for 131072 nodes (sparse-only)
   ✓ Generated data for 262144 nodes (sparse-only)
   ✓ Generated data for 524288 nodes (sparse-only)
   ✓ Generated data for 1048576 nodes (sparse-only)
✅ Data synthesis complete. Files stored in: /scratches/cartwright/mz473/Efficient-Gaussian-Process-on-Graphs/experiments_sparse/scaling_exp/synthetic_data

==================== RANDOM WALK SAMPLING ====================
🚶 Running RW sampling experiments...

Graph sizes:   0%|          | 0/16 [00:00<?, ?it/s]
Processing 32 nodes...
  Seed 1/5 (seed=42)
/scratches/cartwright/mz473/Efficient-Gaussian-Process-on-Graphs/experiments_sparse/scaling_exp/../../efficient_graph_gp_sparse/preprocessor/graph_preprocessor.py:135: UserWarning: Sparse CSR tensor support is in beta state. If you miss a functionality in the sparse tensor support, please submit a feature request to https://github.com/pytorch/pytorch/issues. (Triggered internally at /pytorch/aten/src/ATen/SparseCsrTensorImpl.cpp:53.)
  return torch.sparse_csr_tensor(
  Seed 2/5 (seed=43)
  Seed 3/5 (seed=44)
  Seed 4/5 (seed=45)
  Seed 5/5 (seed=46)

Graph sizes:   6%|▋         | 1/16 [00:02<00:40,  2.73s/it]
Processing 64 nodes...
  Seed 1/5 (seed=42)
  Seed 2/5 (seed=43)
  Seed 3/5 (seed=44)
  Seed 4/5 (seed=45)
  Seed 5/5 (seed=46)

Graph sizes:  12%|█▎        | 2/16 [00:05<00:39,  2.82s/it]
Processing 128 nodes...
  Seed 1/5 (seed=42)
  Seed 2/5 (seed=43)
  Seed 3/5 (seed=44)
  Seed 4/5 (seed=45)
  Seed 5/5 (seed=46)

Graph sizes:  19%|█▉        | 3/16 [00:10<00:46,  3.60s/it]
Processing 256 nodes...
  Seed 1/5 (seed=42)
  Seed 2/5 (seed=43)
  Seed 3/5 (seed=44)
  Seed 4/5 (seed=45)
  Seed 5/5 (seed=46)

Graph sizes:  25%|██▌       | 4/16 [00:17<00:59,  4.93s/it]
Processing 512 nodes...
  Seed 1/5 (seed=42)
  Seed 2/5 (seed=43)
  Seed 3/5 (seed=44)
  Seed 4/5 (seed=45)
  Seed 5/5 (seed=46)

Graph sizes:  31%|███▁      | 5/16 [00:30<01:26,  7.83s/it]
Processing 1024 nodes...
  Seed 1/5 (seed=42)
  Seed 2/5 (seed=43)
  Seed 3/5 (seed=44)
  Seed 4/5 (seed=45)
  Seed 5/5 (seed=46)

Graph sizes:  38%|███▊      | 6/16 [00:58<02:27, 14.75s/it]
Processing 2048 nodes...
  Seed 1/5 (seed=42)
  Seed 2/5 (seed=43)
  Seed 3/5 (seed=44)
  Seed 4/5 (seed=45)
  Seed 5/5 (seed=46)

Graph sizes:  44%|████▁     | 7/16 [01:04<01:48, 12.11s/it]
Processing 4096 nodes...
  Seed 1/5 (seed=42)
  Seed 2/5 (seed=43)
  Seed 3/5 (seed=44)
  Seed 4/5 (seed=45)
  Seed 5/5 (seed=46)

Graph sizes:  50%|█████     | 8/16 [01:15<01:33, 11.69s/it]
Processing 8192 nodes...
  Seed 1/5 (seed=42)
  Seed 2/5 (seed=43)
  Seed 3/5 (seed=44)
  Seed 4/5 (seed=45)
  Seed 5/5 (seed=46)

Graph sizes:  56%|█████▋    | 9/16 [01:34<01:38, 14.01s/it]
Processing 16384 nodes...
  Seed 1/5 (seed=42)
  Seed 2/5 (seed=43)
  Seed 3/5 (seed=44)
  Seed 4/5 (seed=45)
  Seed 5/5 (seed=46)

Graph sizes:  62%|██████▎   | 10/16 [02:11<02:05, 20.88s/it]
Processing 32768 nodes...
  Seed 1/5 (seed=42)
  Seed 2/5 (seed=43)
  Seed 3/5 (seed=44)
  Seed 4/5 (seed=45)
  Seed 5/5 (seed=46)

Graph sizes:  69%|██████▉   | 11/16 [03:19<02:57, 35.55s/it]
Processing 65536 nodes...
  Seed 1/5 (seed=42)
  Seed 2/5 (seed=43)
  Seed 3/5 (seed=44)
  Seed 4/5 (seed=45)
  Seed 5/5 (seed=46)

Graph sizes:  75%|███████▌  | 12/16 [05:35<04:24, 66.00s/it]
Processing 131072 nodes...
  Seed 1/5 (seed=42)
  Seed 2/5 (seed=43)
  Seed 3/5 (seed=44)
  Seed 4/5 (seed=45)
  Seed 5/5 (seed=46)

Graph sizes:  81%|████████▁ | 13/16 [10:04<06:22, 127.38s/it]
Processing 262144 nodes...
  Seed 1/5 (seed=42)
  Seed 2/5 (seed=43)
  Seed 3/5 (seed=44)
  Seed 4/5 (seed=45)
  Seed 5/5 (seed=46)

Graph sizes:  88%|████████▊ | 14/16 [19:01<08:22, 251.15s/it]
Processing 524288 nodes...
  Seed 1/5 (seed=42)
  Seed 2/5 (seed=43)
  Seed 3/5 (seed=44)
  Seed 4/5 (seed=45)
  Seed 5/5 (seed=46)

Graph sizes:  94%|█████████▁| 15/16 [36:54<08:18, 498.81s/it]
Processing 1048576 nodes...
  Seed 1/5 (seed=42)
  Seed 2/5 (seed=43)
  Seed 3/5 (seed=44)
  Seed 4/5 (seed=45)
  Seed 5/5 (seed=46)

Graph sizes: 100%|██████████| 16/16 [1:12:39<00:00, 994.49s/it]
Graph sizes: 100%|██████████| 16/16 [1:12:39<00:00, 272.48s/it]
 rw_sampling results saved:
   Main file: /scratches/cartwright/mz473/Efficient-Gaussian-Process-on-Graphs/experiments_sparse/scaling_exp/stats/rw_sampling_stats.csv
   Timestamped: /scratches/cartwright/mz473/Efficient-Gaussian-Process-on-Graphs/experiments_sparse/scaling_exp/stats/rw_sampling_stats_20250810_020458.csv

✅ RW sampling complete! Processed 80 experiments

==================== SPARSE GP EXPERIMENTS ====================
🚀 Running sparse GP experiments on cuda:0...

Graph sizes:   0%|          | 0/16 [00:00<?, ?it/s]/scratches/cartwright/mz473/Efficient-Gaussian-Process-on-Graphs/venv/lib/python3.12/site-packages/linear_operator/utils/sparse.py:51: UserWarning: TypedStorage is deprecated. It will be removed in the future and UntypedStorage will be the only storage class. This should only matter to you if you are using storages directly.  To access UntypedStorage directly, use tensor.untyped_storage() instead of tensor.storage()
  if nonzero_indices.storage():
/scratches/cartwright/mz473/Efficient-Gaussian-Process-on-Graphs/venv/lib/python3.12/site-packages/linear_operator/utils/sparse.py:66: UserWarning: The torch.cuda.*DtypeTensor constructors are no longer recommended. It's best to use methods such as torch.tensor(data, dtype=*, device='cuda') to create tensors. (Triggered internally at /pytorch/torch/csrc/tensor/python_tensor.cpp:78.)
  res = cls(index_tensor, value_tensor, interp_size)
/scratches/cartwright/mz473/Efficient-Gaussian-Process-on-Graphs/venv/lib/python3.12/site-packages/linear_operator/utils/sparse.py:66: UserWarning: torch.sparse.SparseTensor(indices, values, shape, *, device=) is deprecated.  Please use torch.sparse_coo_tensor(indices, values, shape, dtype=, device=). (Triggered internally at /pytorch/torch/csrc/utils/tensor_new.cpp:653.)
  res = cls(index_tensor, value_tensor, interp_size)

Graph sizes:   6%|▋         | 1/16 [00:27<06:52, 27.49s/it]
Graph sizes:  12%|█▎        | 2/16 [00:48<05:29, 23.50s/it]
Graph sizes:  19%|█▉        | 3/16 [01:10<04:55, 22.72s/it]
Graph sizes:  25%|██▌       | 4/16 [01:33<04:36, 23.04s/it]
Graph sizes:  31%|███▁      | 5/16 [01:57<04:15, 23.26s/it]
Graph sizes:  38%|███▊      | 6/16 [02:21<03:56, 23.68s/it]
Graph sizes:  44%|████▁     | 7/16 [02:45<03:33, 23.72s/it]
Graph sizes:  50%|█████     | 8/16 [03:08<03:06, 23.37s/it]
Graph sizes:  56%|█████▋    | 9/16 [03:31<02:42, 23.25s/it]
Graph sizes:  62%|██████▎   | 10/16 [03:58<02:27, 24.56s/it]
Graph sizes:  69%|██████▉   | 11/16 [04:33<02:19, 27.84s/it]
Graph sizes:  75%|███████▌  | 12/16 [05:39<02:37, 39.44s/it]
Graph sizes:  81%|████████▁ | 13/16 [08:22<03:50, 76.88s/it]
Graph sizes:  88%|████████▊ | 14/16 [13:34<04:55, 147.76s/it]
Graph sizes:  94%|█████████▁| 15/16 [23:07<04:36, 276.03s/it]
Graph sizes: 100%|██████████| 16/16 [44:07<00:00, 572.19s/it]
Graph sizes: 100%|██████████| 16/16 [44:07<00:00, 165.48s/it]
  ✓ 32 nodes, seed 42: RMSE=1.0799
  ✓ 32 nodes, seed 43: RMSE=1.0012
  ✓ 32 nodes, seed 44: RMSE=0.7184
  ✓ 32 nodes, seed 45: RMSE=0.7706
  ✓ 32 nodes, seed 46: RMSE=0.5993
  ✓ 64 nodes, seed 42: RMSE=0.5847
  ✓ 64 nodes, seed 43: RMSE=0.5636
  ✓ 64 nodes, seed 44: RMSE=0.5678
  ✓ 64 nodes, seed 45: RMSE=0.5796
  ✓ 64 nodes, seed 46: RMSE=0.6765
  ✓ 128 nodes, seed 42: RMSE=0.5389
  ✓ 128 nodes, seed 43: RMSE=0.4639
  ✓ 128 nodes, seed 44: RMSE=0.4429
  ✓ 128 nodes, seed 45: RMSE=0.4878
  ✓ 128 nodes, seed 46: RMSE=0.5779
  ✓ 256 nodes, seed 42: RMSE=0.7042
  ✓ 256 nodes, seed 43: RMSE=0.6174
  ✓ 256 nodes, seed 44: RMSE=0.6395
  ✓ 256 nodes, seed 45: RMSE=0.6753
  ✓ 256 nodes, seed 46: RMSE=0.6497
  ✓ 512 nodes, seed 42: RMSE=0.5364
  ✓ 512 nodes, seed 43: RMSE=0.5711
  ✓ 512 nodes, seed 44: RMSE=0.5432
  ✓ 512 nodes, seed 45: RMSE=0.7458
  ✓ 512 nodes, seed 46: RMSE=0.5997
  ✓ 1024 nodes, seed 42: RMSE=0.7129
  ✓ 1024 nodes, seed 43: RMSE=0.5599
  ✓ 1024 nodes, seed 44: RMSE=0.5569
  ✓ 1024 nodes, seed 45: RMSE=0.5463
  ✓ 1024 nodes, seed 46: RMSE=0.5404
  ✓ 2048 nodes, seed 42: RMSE=0.5505
  ✓ 2048 nodes, seed 43: RMSE=0.5959
  ✓ 2048 nodes, seed 44: RMSE=0.6361
  ✓ 2048 nodes, seed 45: RMSE=0.5582
  ✓ 2048 nodes, seed 46: RMSE=0.5863
  ✓ 4096 nodes, seed 42: RMSE=0.5704
  ✓ 4096 nodes, seed 43: RMSE=0.5313
  ✓ 4096 nodes, seed 44: RMSE=0.6016
  ✓ 4096 nodes, seed 45: RMSE=0.6309
  ✓ 4096 nodes, seed 46: RMSE=0.6097
  ✓ 8192 nodes, seed 42: RMSE=0.5975
  ✓ 8192 nodes, seed 43: RMSE=0.6036
  ✓ 8192 nodes, seed 44: RMSE=0.6118
  ✓ 8192 nodes, seed 45: RMSE=1.0210
  ✓ 8192 nodes, seed 46: RMSE=0.6303
  ✓ 16384 nodes, seed 42: RMSE=0.5904
  ✓ 16384 nodes, seed 43: RMSE=0.8090
  ✓ 16384 nodes, seed 44: RMSE=0.5941
  ✓ 16384 nodes, seed 45: RMSE=0.5801
  ✓ 16384 nodes, seed 46: RMSE=0.5955
  ✓ 32768 nodes, seed 42: RMSE=0.6028
  ✓ 32768 nodes, seed 43: RMSE=0.6479
  ✓ 32768 nodes, seed 44: RMSE=0.6146
  ✓ 32768 nodes, seed 45: RMSE=0.7382
  ✓ 32768 nodes, seed 46: RMSE=0.6189
  ✓ 65536 nodes, seed 42: RMSE=0.6237
  ✓ 65536 nodes, seed 43: RMSE=0.6142
  ✓ 65536 nodes, seed 44: RMSE=0.6076
  ✓ 65536 nodes, seed 45: RMSE=0.6735
  ✓ 65536 nodes, seed 46: RMSE=0.6741
  ✓ 131072 nodes, seed 42: RMSE=0.6093
  ✓ 131072 nodes, seed 43: RMSE=0.6092
  ✓ 131072 nodes, seed 44: RMSE=0.6715
  ✓ 131072 nodes, seed 45: RMSE=0.5998
  ✓ 131072 nodes, seed 46: RMSE=0.6120
  ✓ 262144 nodes, seed 42: RMSE=0.6039
  ✓ 262144 nodes, seed 43: RMSE=0.7647
  ✓ 262144 nodes, seed 44: RMSE=0.6025
  ✓ 262144 nodes, seed 45: RMSE=0.6160
  ✓ 262144 nodes, seed 46: RMSE=0.6158
  ✓ 524288 nodes, seed 42: RMSE=0.7211
  ✓ 524288 nodes, seed 43: RMSE=0.6016
  ✓ 524288 nodes, seed 44: RMSE=0.6129
  ✓ 524288 nodes, seed 45: RMSE=0.9845
  ✓ 524288 nodes, seed 46: RMSE=0.6231
  ✓ 1048576 nodes, seed 42: RMSE=0.6078
  ✓ 1048576 nodes, seed 43: RMSE=0.6082
  ✓ 1048576 nodes, seed 44: RMSE=0.6071
  ✓ 1048576 nodes, seed 45: RMSE=0.6131
  ✓ 1048576 nodes, seed 46: RMSE=0.6783
 sparse_gp_scaling results saved:
   Main file: /scratches/cartwright/mz473/Efficient-Gaussian-Process-on-Graphs/experiments_sparse/scaling_exp/stats/sparse_gp_scaling_stats.csv
   Timestamped: /scratches/cartwright/mz473/Efficient-Gaussian-Process-on-Graphs/experiments_sparse/scaling_exp/stats/sparse_gp_scaling_stats_20250810_024906.csv
✅ Sparse GP scaling complete! Processed 80 experiments

==================== DENSE GP EXPERIMENTS ====================
🚀 Running dense GP experiments...

Graph sizes:   0%|          | 0/6 [00:00<?, ?it/s]I0000 00:00:1754790547.822957 1356132 gpu_device.cc:2019] Created device /job:localhost/replica:0/task:0/device:GPU:0 with 9437 MB memory:  -> device: 0, name: NVIDIA GeForce RTX 2080 Ti, pci bus id: 0000:17:00.0, compute capability: 7.5
I0000 00:00:1754790547.824387 1356132 gpu_device.cc:2019] Created device /job:localhost/replica:0/task:0/device:GPU:1 with 9608 MB memory:  -> device: 1, name: NVIDIA GeForce RTX 2080 Ti, pci bus id: 0000:b3:00.0, compute capability: 7.5
WARNING: All log messages before absl::InitializeLog() is called are written to STDERR
I0000 00:00:1754790549.704236 1356132 cuda_solvers.cc:175] Creating GpuSolver handles for stream 0x71b58b40

Graph sizes:  17%|█▋        | 1/6 [00:12<01:00, 12.00s/it]
Graph sizes:  33%|███▎      | 2/6 [00:20<00:39,  9.95s/it]
Graph sizes:  50%|█████     | 3/6 [00:28<00:27,  9.13s/it]
Graph sizes:  67%|██████▋   | 4/6 [00:36<00:17,  8.72s/it]
Graph sizes:  83%|████████▎ | 5/6 [00:43<00:08,  8.07s/it]
Graph sizes: 100%|██████████| 6/6 [00:56<00:00,  9.67s/it]
Graph sizes: 100%|██████████| 6/6 [00:56<00:00,  9.41s/it]
    Loaded pre-computed dense step matrices with shape (32, 32, 3)
  ✓ 32 nodes, seed 42: RMSE=0.2791
    Loaded pre-computed dense step matrices with shape (32, 32, 3)
  ✓ 32 nodes, seed 43: RMSE=0.3195
    Loaded pre-computed dense step matrices with shape (32, 32, 3)
  ✓ 32 nodes, seed 44: RMSE=0.3429
    Loaded pre-computed dense step matrices with shape (32, 32, 3)
  ✓ 32 nodes, seed 45: RMSE=0.2608
    Loaded pre-computed dense step matrices with shape (32, 32, 3)
  ✓ 32 nodes, seed 46: RMSE=0.2935
    Loaded pre-computed dense step matrices with shape (64, 64, 3)
  ✓ 64 nodes, seed 42: RMSE=0.1831
    Loaded pre-computed dense step matrices with shape (64, 64, 3)
  ✓ 64 nodes, seed 43: RMSE=0.1941
    Loaded pre-computed dense step matrices with shape (64, 64, 3)
  ✓ 64 nodes, seed 44: RMSE=0.1534
    Loaded pre-computed dense step matrices with shape (64, 64, 3)
  ✓ 64 nodes, seed 45: RMSE=0.1729
    Loaded pre-computed dense step matrices with shape (64, 64, 3)
  ✓ 64 nodes, seed 46: RMSE=0.1563
    Loaded pre-computed dense step matrices with shape (128, 128, 3)
  ✓ 128 nodes, seed 42: RMSE=0.1818
    Loaded pre-computed dense step matrices with shape (128, 128, 3)
  ✓ 128 nodes, seed 43: RMSE=0.2273
    Loaded pre-computed dense step matrices with shape (128, 128, 3)
  ✓ 128 nodes, seed 44: RMSE=0.2319
    Loaded pre-computed dense step matrices with shape (128, 128, 3)
  ✓ 128 nodes, seed 45: RMSE=0.1817
    Loaded pre-computed dense step matrices with shape (128, 128, 3)
  ✓ 128 nodes, seed 46: RMSE=0.2243
    Loaded pre-computed dense step matrices with shape (256, 256, 3)
  ✓ 256 nodes, seed 42: RMSE=0.2967
    Loaded pre-computed dense step matrices with shape (256, 256, 3)
  ✓ 256 nodes, seed 43: RMSE=0.2721
    Loaded pre-computed dense step matrices with shape (256, 256, 3)
  ✓ 256 nodes, seed 44: RMSE=0.2977
    Loaded pre-computed dense step matrices with shape (256, 256, 3)
  ✓ 256 nodes, seed 45: RMSE=0.3213
    Loaded pre-computed dense step matrices with shape (256, 256, 3)
  ✓ 256 nodes, seed 46: RMSE=0.2748
    Loaded pre-computed dense step matrices with shape (512, 512, 3)
  ✓ 512 nodes, seed 42: RMSE=0.2789
    Loaded pre-computed dense step matrices with shape (512, 512, 3)
  ✓ 512 nodes, seed 43: RMSE=0.2816
    Loaded pre-computed dense step matrices with shape (512, 512, 3)
  ✓ 512 nodes, seed 44: RMSE=0.2759
    Loaded pre-computed dense step matrices with shape (512, 512, 3)
  ✓ 512 nodes, seed 45: RMSE=0.2812
    Loaded pre-computed dense step matrices with shape (512, 512, 3)
  ✓ 512 nodes, seed 46: RMSE=0.2777
    Loaded pre-computed dense step matrices with shape (1024, 1024, 3)
  ✓ 1024 nodes, seed 42: RMSE=0.2466
    Loaded pre-computed dense step matrices with shape (1024, 1024, 3)
  ✓ 1024 nodes, seed 43: RMSE=0.2613
    Loaded pre-computed dense step matrices with shape (1024, 1024, 3)
  ✓ 1024 nodes, seed 44: RMSE=0.2598
    Loaded pre-computed dense step matrices with shape (1024, 1024, 3)
  ✓ 1024 nodes, seed 45: RMSE=0.2383
    Loaded pre-computed dense step matrices with shape (1024, 1024, 3)
  ✓ 1024 nodes, seed 46: RMSE=0.2496
 dense_gp_scaling results saved:
   Main file: /scratches/cartwright/mz473/Efficient-Gaussian-Process-on-Graphs/experiments_sparse/scaling_exp/stats/dense_gp_scaling_stats.csv
   Timestamped: /scratches/cartwright/mz473/Efficient-Gaussian-Process-on-Graphs/experiments_sparse/scaling_exp/stats/dense_gp_scaling_stats_20250810_025004.csv
✅ Dense GP scaling complete! Processed 30 experiments

================================================================================
EXPERIMENT SUMMARY
================================================================================

📊 Random Walk Performance:
   • Average Speedup: 3.17x
   • Average Compression: 56.0x
   • Total Experiments: 80
   • Sparse-only (large graphs): 50 experiments

🚀 Sparse GP Performance:
   • Graph sizes: [32, 64, 128, 256, 512, 1024, 2048, 4096, 8192, 16384, 32768, 65536, 131072, 262144, 524288, 1048576]
   • Average RMSE: 0.6342
   • Average training time: 31.95s
   • Total experiments: 80

🚀 Dense GP Performance:
   • Graph sizes: [32, 64, 128, 256, 512, 1024]
   • Average RMSE: 0.2505
   • Average training time: 1.49s
   • Total experiments: 30

⚖️  Dense vs Sparse Comparison (common sizes: [32, 64, 128, 256, 512, 1024]):
   • Speed improvement: 0.35x
   • RMSE difference: 0.3778

🎉 Scaling experiment completed successfully!
 Results saved to: /scratches/cartwright/mz473/Efficient-Gaussian-Process-on-Graphs/experiments_sparse/scaling_exp/stats
